id,name,data
1,Музей современного искусства Эрарта,"«Эрарта»— частный и первыймузей современного искусствавСанкт-ПетербургенаВасильевском острове. Название расшифровывается как «эра арта» — «эра искусства»[1][2]. В 2017 и 2019 году входил в четвёрку самых посещаемых музеев города[3][4]. Пятиэтажное здание, в котором располагается «Эрарта», было построено в 1951 году для местногорайкома. В советское время здесь размещалсяВсесоюзный НИИ синтетического каучука имени С. В. Лебедева. Вход в музей украшают две скульптуры — Эра и Арта, созданные скульпторомДмитрием Жуковымпо заказу «Эрарты». В интерьерах «Эрарты» использован wall-art — авторская настенная живопись. В музее собрано более 2800 работ современных художников[5]. Среди них не только живопись, но и графика, скульптура, инсталляции, видео-арт[6]. Основу коллекции «Эрарты» составляют работы петербургских художников, однако музей ищет таланты по всей стране, приглашая к сотрудничеству и художников из регионов[7]. Музей активно работает в направлении нового вида искусства «science art»[8]. Художники, работы которых находятся в собрании музея «Эрарта», представляют разные поколения и направления в современном российском искусстве: от 50-60-х годовXX векадо наших дней, отреализмадоабстракцииипримитивизма. На данный момент список авторов насчитывает более 300 фамилий[9]. Наиболее известные мастера —Завен Аршакуни,Вячеслав Михайлов,Владимир Духовлинов,Владимир Овчинников,Елена Фигурина,Валерий Лукка,Ринат Волигамси,Александр Дашевский, Владимир Мигачев,Владлен Гаврильчик,Николай Копейкин,Петр Горбань,Андрей Рудьев,Евгений Ухналёв. С 30 июня 2015 года коллекция музея доступна онлайн наGoogle Art Project[10]. Первых посетителей музей принял 20 мая 2010 года. Следующие четыре месяца музей работал в тестовом режиме, продолжалась развеска картин и обустройство залов. Официальное открытие состоялось 30 сентября 2010 года[11]. «Эрарта» устраивает выставки, издаёт музейные каталоги, проводит экскурсии, реализует собственные проекты и образовательные программы. С 2013 по 2017 год музей «Эрарта» проводит единственный в мире международный фестиваль короткометражного кино о живописиErarta MOTION PICTURES. С 2013 по 2015 год «Эрарта» проводит фестиваль синтеза искусств Cross Art. Любой желающий мог подать заявку на участие в фестивале со своей работой. Основное требование: смешение в работе нескольких видов искусств[12]. С 2013 по 2018 год на базе музея действовал проект «„Эрарта“ Сцена» — концертная площадка, принимавшая концерты актуальных музыкальных коллективов, спектакли и лекции[13]. В «Эрарте» несколько кинозалов. В одном из них (на третьем этаже) показывают «Изоанимацию» — ожившие картины, анимация по мотивам живописных полотен. В другом — образовательный мультфильм об искусстве «Чёрный квадрат» (2014)[14][15][16]. С 2021 в «Эрарте» проходят съёмки шоу «Игроки». Ежегодно музей «Эрарта» проводит около 30 временных выставок живописи, скульптуры, моды, фотографии, дизайна, видеоарта. Музей работает как с начинающими авторами, так и со звездами мировой арт-сцены, проводит выставки и российских, и зарубежных современных художников[17][18]. Ресторан Erarta расположен на первом этаже музея «Эрарта». Он имеет два зала, рассчитанных на 100 мест и украшенных произведениями современных российских художников[51]. Ресторан работает по принципуà la carte. В городе он известен своими десертами — их признали одними из лучших в Петербурге TripAdvisor[52]иTime Out[53][54]. К отдельным крупным выставочным проектам музея «Эрарта» ресторан также создает особые десерты[55]."
2,Государственный Эрмитаж,"Эрмита́ж(отфр.ermitage— место уединения, келья, приют отшельника, затворничество),Госуда́рственный Эрмита́ж[2](сокр.ГЭ; до 1917 года —Императорский Эрмитаж) —российскийгосударственныйхудожественныйи культурно-исторический музей вСанкт-Петербурге, одно изкрупнейших в мире учреждений подобного рода[3][4][5]. Главный музейный комплекс Эрмитажа расположен в историческом центре Санкт-Петербурга, включает в себя шесть связанных между собой зданий —Зимний дворец,Запасной дом Зимнего дворца,Малый Эрмитаж,Большой (Старый) Эрмитаж,Новый ЭрмитажиЭрмитажный театр. В них открыты для посещения 365 залов. Также в распоряжении музея находятсяГлавный штаб,Музей Императорского фарфорового завода, реставрационно-хранительский центр «Старая Деревня» иМеншиковский дворец. Общая площадь помещений (зданий) Эрмитажа составляет 233 345 м², экспозиционно-выставочная площадь — 100 000 м²[6][⇨]. 
Современная коллекция музея насчитывает около трёх миллионов произведений искусства и памятников мировой культуры[6], собранных начиная скаменного векаи до нашего столетия. В составе коллекции —живопись,графика,скульптураи предметыприкладного искусства,археологическиенаходки инумизматическийматериал[6]. Эрмитаж возник как частная коллекция произведений искусства, приобретавшихся в частном порядке российской императрицейЕкатериной IIс начала её царствования[7]. Первоначально это собрание размещалось в главной императорской резиденции в специальном дворцовом флигеле — Эрмитаже (в современном комплексе — Малый Эрмитаж) — откуда и закрепилось общее название будущего музея[8]. В 1852 году из сильно разросшейся коллекции был сформирован и открыт для посещения публичный музей, расположившийся в специально для этого построенном зданииНового Эрмитажа. Государственный Эрмитаж входит в  десяткусамых посещаемых художественных музеев мира[9]. По результатам 2018 года он занял 9-е место по посещаемости среди музеев мира (в 2018 году там побывали 4,2 миллиона человек)[10]. В 2019 году Эрмитаж принял 4 956 524 посетителя, заняв 8-е место среди самых посещаемых художественных музеев мира[11].Согласно данным 2021 годамузей занял 6-е место в мире с 1 649 443 посетителями[12]. Картинная галерея Императорского Эрмитажа возникла в 1764 году как частное собраниеЕкатерины II, после того, как ей были переданы изБерлина317 ценных картин (по расхожим слухам их было лишь 225) общей стоимостью в 183 тысячи талеров из частной коллекции живописи коммерсантаИоганна Эрнеста Гоцковского(1710—1775), в счёт его долга, возникшего из-за неудачной попытки поставки зерна в русскую армию, при участиикнязя Владимира Сергеевича Долгорукова[13]. Среди них были полотна таких мастеров, какДирк ван Бабюрен,Хендрик ван Бален,Рембрандт ван Рейн,Питер Пауль Рубенс,Якоб Йорданс,Антонис ван Дейк,Хендрик Гольциус,Франс Хальс,Ян Стен,Геррит ван Хонтхорсти другие произведения, в основномголландско-фламандскойшколы первой половины XVII века. Эти полотна стали основой, на которой сформировался музей. Из 317 картин, переданных в Россию в1764 году, сегодня в Эрмитаже хранится по меньшей мере 96 полотен[14]. Поначалу большинство картин размещалось в уединённых апартаментах дворца (нынеМалый Эрмитаж). Впоследствии апартаменты получили название «Эрмитаж». В 1769 году при содействии князяАндрея Михайловича Белосельского-БелозерскоговДрезденедля Эрмитажа была приобретена за 90 000рублейколлекция скончавшегосяграфа Генриха фон Брюля— бывшего первого министра  короля польского и курфюрста саксонскогоАвгуста III. Коллекция насчитывала около 600 картин голландских, фламандских, французских и итальянских художников, в том числе пейзажТициана«Бегство в Египет», виды Дрездена и Пирны кистиБеллоттои другие[15]. Очень большое значение для Эрмитажа имела в 1772 году покупка Екатериной при посредничестве князя Д. А. Голицына в Парижеколлекции живописибарона ПьераКроза— самой замечательной в Париже того времени после галереи герцогов Орлеанских. Это собрание, включавшее около 400 первоклассных полотен, во многом предопределило «лицо» картинной галереи. Преобладали картины итальянских, французских, фламандских и голландских мастеров XVI—XVIII века. В их числе — «Святое Семейство»Рафаэля, «Юдифь»Джорджоне, «Даная»Тициана, картиныРембрандта, произведенияРубенса,Ван Дейка,Джамбаттиста Питтони,Пуссена, пейзажиКлода Лорренаи работыВатто. Коллекция живописи британского премьер-министраУолпола, приобретённая в 1779 году, добавила ряд шедевров Рембрандта (среди них«Жертвоприношение Авраама»и«Немилость Амана») и группу портретов кисти Ван Дейка. Импульсом к развитию графического собрания послужило приобретение в 1768 году более 5 тысяч рисунков из коллекцииКобенцлявБрюсселе, в которой находился«Портрет неизвестного»работыЖана Фуке. В 1781 году в Париже была куплена коллекция графа Бодуэна, состоявшая из 119 картин, в числе которых девять полотен Рембрандта и шесть портретов кисти Антониса ван Дейка. Ещё одним значительным приобретением стала коллекция английского банкира Лайд-Брауна, включавшая античные статуи и бюсты, в том числе скульптуруМикеланджело«Скорчившийся мальчик». Из-за недостатка (малого размера) первоначального помещения архитекторомФельтеномв 1771—1787 годах строится зданиеБольшого Эрмитажа. В 1787 году вПарижебыла куплена коллекция резных камней герцога Орлеанского. Кроме того, Екатерина заказывала работыШардену,Гудону,Рёнтгенуи другим мастерам. Ею же были приобретены библиотекиВольтераиДидро. В посмертной описи имущества Екатерины 1796 года перечисляются 3996 картин[16]. Таким образом, только за время царствования Екатерины II в России, где до этого не было ни одного сколько-нибудь значительного собрания живописи (покупать европейскую живопись для украшения своих дворцов начал ещёПётр I), появилась уникальная галерея. В правлениеАлександра IиНиколая Iзакупаются уже не только коллекции, но и отдельные произведения художников, чьи работы отсутствовали в Эрмитаже. В Риме на распродаже коллекцииДжустинианичерезВиван-Денонабыли приобретены «Лютнист»Караваджои «Госпожа со служанкой»П. де Хоха[17]. В 1819 году была куплена «Мадонна в пейзаже», приписываемая кистиДжорджоне.Жозефина БогарнеподарилаАлександру Iкамею Гонзага, а после её смерти была приобретена и вся галерея дворцаМальмезон, происходившая в основномиз Касселя. Ещё одной вехой для музея стало приобретение собрания испанской живописи Кузвельта (1814). Николай I, реализовавший идею превращения Эрмитажа в публичный музей, внёс существенный вклад в пополнение картинной галереи Эрмитажа. На второй распродаже коллекции Кузвельта был куплен шедеврРафаэля«Мадонна Альба» и «Три Марии у склепа Христа»Аннибале Карраччи. В 1845 году по завещаниюТатищевак собранию приобщились диптихРобера Кампена«Троица. Богоматерь у камина», ранний диптихван Эйка«Распятие. Страшный Суд» и другие работы старых мастеров. Примерно тогда же на аукционе коллекции короля НидерландовВиллема IIбыли приобретены «Благовещение» ван Эйка, «Пьета»Себастьяно дель Пьомбои «Снятие с креста»Госсарта. В Венеции купили работы мастеров итальянского Ренессанса, в том числе шедевры Тициана (например, «Несение креста») иПальмы Веккьо. Огромный вклад в изучение и каталогизацию коллекции картинной галереи Императорского Эрмитажа, проработав хранителем картин и рисунков, а затем и старшим хранителем Эрмитажа в общей сложности 22 года, внёсАндрей Иванович Сомов. Считается, что он положил начало новому этапу в истории русского искусствознания второй половины XIX — начала XX веков. Среди картин этого периода есть важная работа — портретНиколая Юсупова, написанный итальянским мастеромВинченцо Петрочелли(1851). До серединыXIX векаЭрмитаж полностью соответствовал своему названию (отфр.Ermitage— уединённое место, приют отшельника), поскольку посещать музей могли лишь избранные[источник не указан 180 дней]. Так,А. С. Пушкинсмог получить пропуск только благодаря рекомендацииВ. А. Жуковского, служившего наставником у сына императора[источник не указан 180 дней]. Эрмитаж был открыт для публики при императоре Николае I5(17) февраля1852года[18][19]в специально построенном для этой цели зданииНового Эрмитажа. Тогда он насчитывал богатейшие коллекции памятников древневосточной, древнеегипетской, античной и средневековой культур, искусства Западной и Восточной Европы, археологических и художественных памятниковАзии, русской культуры VIII—XIX веков. К 1880 году посещаемость музея достигла 50 000 человек в год. В XIX веке в Эрмитаж начинают систематически поступать произведения русских живописцев, чему во второй половине столетия способствовала деятельностьА. И. Сомова, титаническим трудом которого были исследованы и каталогизированы произведения живописи и рисунков, проведена работа по пополнению фондов благодаря дарению и закупки у отечественных коллекционеров и некоторых музеев. Результатом работы Сомова стал изданный им «Каталог Картинной галереи Эрмитажа» итальянской и испанской живописи. Приказом по министерству императорского двора он был назначен старшим хранителем по отделу картин, рисунков и гравюр Императорского Эрмитажа. В1895 годучасть произведений русских художников были переданыРусскому музею. В музей передаются материалы археологических раскопок, значительно обогатившие его отдел. К началу XX века в музее хранились уже тысячи полотен, затем в его коллекции появились и новые произведения искусства. Таким образом, Эрмитаж стал центром русского искусствознания и в жизни Эрмитажа пришла новая эра. В то же время с возникновением научного подхода кискусствоведениюнемало картин, которые приобретались императорами за огромные деньги как работы Рафаэля или Леонардо да Винчи, были переатрибутированы как работы их учеников. После падения императорской власти Эрмитаж претерпел существенные преобразования. Музей значительно обогатился за счёт национализированных частных коллекций и собранияАкадемии художеств. Поступили в числе прочего работыБоттичелли,Андреа дель Сарто,Корреджо,Ван Дейка,Рембрандта,Кановы,Энгра,Делакруа. Из основного собрания Зимнего дворца музей получил множество предметов интерьера, а также преподнесённыеНадир-ШахомсокровищаВеликих Моголов.
